{
  "edges": [
    {
      "explanation": "Lex Fridman and Yannic Kilcher overlap around Local Inference, Multimodal, Open Source Models; topic-overlap score 0.38.",
      "method": "topic_overlap",
      "shared_topics": [
        {
          "label": "Local Inference",
          "score": 0.728,
          "slug": "local-inference"
        },
        {
          "label": "Multimodal",
          "score": 0.703,
          "slug": "multimodal"
        },
        {
          "label": "Open Source Models",
          "score": 0.782,
          "slug": "open-source-models"
        }
      ],
      "similarity_score": 0.375,
      "source": "UCSHZKyawb77ixDdsGog4iWA",
      "target": "UCZHmQk67mSJgfCCTn7xBfew"
    },
    {
      "explanation": "AI Explained and Lex Fridman overlap around AI Agents, Evaluation, Safety and Alignment; topic-overlap score 0.33.",
      "method": "topic_overlap",
      "shared_topics": [
        {
          "label": "AI Agents",
          "score": 0.788,
          "slug": "agents"
        },
        {
          "label": "Evaluation",
          "score": 0.619,
          "slug": "evals"
        },
        {
          "label": "Safety and Alignment",
          "score": 0.675,
          "slug": "safety-alignment"
        }
      ],
      "similarity_score": 0.333,
      "source": "UCNJ1Ymd5yFuUPtn21xtRbbw",
      "target": "UCSHZKyawb77ixDdsGog4iWA"
    },
    {
      "explanation": "AI Explained and Yannic Kilcher overlap around Model Releases; topic-overlap score 0.12.",
      "method": "topic_overlap",
      "shared_topics": [
        {
          "label": "Model Releases",
          "score": 0.719,
          "slug": "model-releases"
        }
      ],
      "similarity_score": 0.125,
      "source": "UCNJ1Ymd5yFuUPtn21xtRbbw",
      "target": "UCZHmQk67mSJgfCCTn7xBfew"
    }
  ],
  "generated_at": "2026-10-24T12:40:37Z",
  "nodes": [
    {
      "id": "UCNJ1Ymd5yFuUPtn21xtRbbw",
      "label": "AI Explained",
      "top_topics": [
        "Model Releases",
        "AI Agents",
        "Safety and Alignment",
        "Benchmarks"
      ],
      "video_count": 3
    },
    {
      "id": "UCSHZKyawb77ixDdsGog4iWA",
      "label": "Lex Fridman",
      "top_topics": [
        "Coding Assistants",
        "AI Agents",
        "Open Source Models",
        "Multimodal"
      ],
      "video_count": 2
    },
    {
      "id": "UCZHmQk67mSJgfCCTn7xBfew",
      "label": "Yannic Kilcher",
      "top_topics": [
        "Open Source Models",
        "Local Inference",
        "Multimodal",
        "Model Releases"
      ],
      "video_count": 2
    }
  ],
  "schema_version": "1.0"
}
